{
  "schemaVersion": 1,
  "artifactType": "snapshot",
  "generatedAt": "2026-08-09T10:00:00Z",
  "snapshotId": "snapshot-20260809-001",
  "provider": "analytics-admin",
  "apiChannel": "v1beta",
  "resource": "properties/200",
  "stateSha256": "1111111111111111111111111111111111111111111111111111111111111111",
  "state": {"displayName": "Example"},
  "requestIds": ["request-1"]
}
